Id,QuoteNumber,OpportunityId,AccountId,Name,Status,ExpirationDate,Subtotal,Discount,TotalPrice,Tax,GrandTotal,ShippingHandling,Description,IsSyncing,OwnerId,CreatedDate,LastModifiedDate,IsDeleted
0Q000010490,QT-100490,00600010553,00100010497,Quote for Dominguez Group - Q3 2024,Accepted,2024-06-09,41401.58,5104.6,39200.74,2903.76,39200.74,355.31,"Senior five tough condition professor light on apply. Sell send some system little forget. Mr hold significant prepare see.
Night gas town threat north still. Nearly foot agency PM society hour high.",False,0050015,2024-05-10 17:21:13,2024-05-16 17:21:13,False
0Q000010491,QT-100491,00600010553,00100010497,Quote for Dominguez Group - Q3 2024,Accepted,2024-05-29,42673.99,3826.39,41955.41,3107.81,41955.41,145.53,"Street more clear his southern heavy risk. Check suffer Congress instead. Economy treatment hard send magazine.
Black program forward despite. Program charge lead second mission.",False,0050015,2024-04-29 17:21:13,2024-05-10 17:21:13,False
0Q000010492,QT-100492,00600010555,00100010500,Quote for Walker PLC - Q2 2024,Rejected,2026-04-27,271831.58,31443.76,259618.85,19231.03,259618.85,19.81,Life financial information. Worker hundred free evidence.,False,0050013,2026-03-28 17:21:13,2026-04-22 17:21:13,False
0Q000010493,QT-100493,00600010557,00100010502,Quote for Clements-Sparks - Q1 2025,In Review,2023-04-09,18819.0,1723.71,18462.91,1367.62,18462.91,294.85,"Fight toward Congress list seem agent. Before I democratic third police store cell.
Fear such agreement people worry. Establish cost military.",False,0050017,2023-03-10 17:21:13,2023-03-23 17:21:13,False
0Q000010494,QT-100494,00600010559,00100010504,Quote for Watson-Hall - Q4 2025,Draft,2022-10-10,14573.31,1810.89,13783.41,1020.99,13783.41,125.68,"Everyone relationship but. His fear draw buy stop. First old quite bring spring first maybe.
Hold participant argue. Partner land hot tree.",False,0050005,2022-09-10 17:21:13,2022-09-22 17:21:13,False
0Q000010495,QT-100495,00600010560,00100010506,"Quote for Sanchez, Baker and Moore - Q1 2025",Approved,2022-12-07,22800.73,234.88,24371.12,1805.27,24371.12,172.36,New best particularly nor care network media. Whom perhaps or loss price system. Company require boy theory test learn. Red growth onto do behavior tax.,False,0050015,2022-11-07 17:21:13,2022-11-08 17:21:13,False
0Q000010496,QT-100496,00600010560,00100010506,"Quote for Sanchez, Baker and Moore - Q1 2025",Rejected,2022-12-01,20554.99,124.24,22065.21,1634.46,22065.21,75.17,Free word society star fine. Same sometimes may term decade mission.,False,0050015,2022-11-01 17:21:13,2022-11-25 17:21:13,False
0Q000010497,QT-100497,00600010561,00100010507,"Quote for Spencer, Blair and Long - Q2 2025",Rejected,2023-12-01,22601.23,2195.8,22037.86,1632.43,22037.86,311.66,"Including focus president.
Firm look employee what remain. Alone term same force. Can artist word citizen want.",False,0050006,2023-11-01 17:21:13,2023-11-04 17:21:13,False
0Q000010498,QT-100498,00600010561,00100010507,"Quote for Spencer, Blair and Long - Q2 2025",Approved,2023-12-11,24968.27,418.75,26513.48,1963.96,26513.48,160.71,"World or level hope. From how store surface machine society suddenly.
Carry field worker social. Behind quickly bad generation.
Individual bill smile size ball then choose.",False,0050006,2023-11-11 17:21:13,2023-11-21 17:21:13,False
0Q000010499,QT-100499,00600010562,00100010507,"Quote for Spencer, Blair and Long - Q3 2024",Accepted,2023-05-28,160728.82,21529.29,150335.49,11135.96,150335.49,101.98,Environment population certainly whole we natural region take. Soldier develop involve.,False,0050006,2023-04-28 17:21:13,2023-05-03 17:21:13,False
0Q000010500,QT-100500,00600010563,00100010509,"Quote for Baldwin, Wilson and Barry - Q1 2024",Presented to Customer,2025-07-07,20108.39,2464.11,19055.82,1411.54,19055.82,246.2,"Couple especially those development manage thank. Despite why develop watch will past fight everyone.
Democratic address never trade maybe. Office now become quite easy quite same.",False,0050013,2025-06-07 17:21:13,2025-06-23 17:21:13,False
0Q000010501,QT-100501,00600010563,00100010509,"Quote for Baldwin, Wilson and Barry - Q1 2024",Rejected,2025-07-19,21543.19,1815.79,21305.59,1578.19,21305.59,253.68,Store see very term bring. Scientist discover generation production who let least.,False,0050013,2025-06-19 17:21:13,2025-07-19 17:21:13,False
0Q000010502,QT-100502,00600010564,00100010510,"Quote for Lopez, Johnson and Williams - Q3 2024",Accepted,2025-01-17,73353.35,4310.34,74566.45,5523.44,74566.45,51.63,"Past cause appear quality. Season home impact continue top list age. Night before interest box agency.
Son until not anyone rate town few. Sport group bar character race.",False,0050010,2024-12-18 17:21:13,2024-12-19 17:21:13,False
0Q000010503,QT-100503,00600010565,00100010511,Quote for Johnson and Sons - Q4 2024,Approved,2025-06-04,108599.25,4608.14,112310.4,8319.29,112310.4,199.73,"Upon father music rate. State region run contain. Week story property off people life.
Quickly five social recently ball. Expert employee sport paper foreign particular. Make between exactly.",False,0050013,2025-05-05 17:21:13,2025-06-04 17:21:13,False
0Q000010504,QT-100504,00600010567,00100010512,Quote for Clark Inc - Q1 2025,Presented to Customer,2024-03-07,56451.84,1984.07,58825.19,4357.42,58825.19,265.94,"Land try effort sit. War surface including trip but. Ever red bank morning hope son when.
Floor wind natural during. Here receive relate material should break lawyer alone.",False,0050012,2024-02-06 17:21:13,2024-02-23 17:21:13,False
0Q000010505,QT-100505,00600010568,00100010513,Quote for Curtis-Ortega - Q4 2025,Rejected,2025-09-25,68367.04,302.57,73509.63,5445.16,73509.63,97.49,"Factor magazine data southern. Agent anyone price market become yeah religious.
Natural relationship station lot have carry even. Leave focus table doctor.",False,0050015,2025-08-26 17:21:13,2025-08-28 17:21:13,False
0Q000010506,QT-100506,00600010569,00100010513,Quote for Curtis-Ortega - Q1 2024,Presented to Customer,2026-01-24,48380.55,5692.11,46103.52,3415.08,46103.52,211.13,"Experience bank call. Religious difference determine federal involve.
Vote play recently them use number. Benefit region worry behind to maybe possible.",False,0050015,2025-12-25 17:21:13,2026-01-24 17:21:13,False
0Q000010507,QT-100507,00600010570,00100010513,Quote for Curtis-Ortega - Q1 2024,In Review,2026-04-25,220277.29,24625.02,211304.45,15652.18,211304.45,84.68,Life protect north carry memory best. Increase support to role project. See through require ok.,False,0050015,2026-03-26 17:21:13,2026-04-08 17:21:13,False
0Q000010508,QT-100508,00600010571,00100010514,Quote for Colon-Frank - Q1 2024,Accepted,2022-08-29,430752.39,17083.36,446762.55,33093.52,446762.55,416.2,"Area leader why hit walk with. Follow exist sit follow language.
Country during admit. Rate share short member.",False,0050008,2022-07-30 17:21:13,2022-08-01 17:21:13,False
0Q000010509,QT-100509,00600010572,00100010515,Quote for Ramirez-Jackson - Q2 2024,Accepted,2026-04-03,10624.82,283.97,11168.12,827.27,11168.12,109.9,"Wide benefit expert. Note defense seem raise when nice road push.
Security sister way respond number through. Speech interest west probably concern agree course. Audience amount forget we treatment.",False,0050001,2026-03-04 17:21:13,2026-03-17 17:21:13,False
0Q000010510,QT-100510,00600010573,00100010515,Quote for Ramirez-Jackson - Q2 2024,Approved,2026-04-01,30228.87,4517.58,27768.19,2056.9,27768.19,253.28,"Center again bank mission.
Executive game option foot range somebody choose. Bar land share responsibility. Full turn rest.
Benefit green condition ago cut.",False,0050001,2026-03-02 17:21:13,2026-03-16 17:21:13,False
0Q000010511,QT-100511,00600010577,00100010519,"Quote for Lawrence, Fischer and Pope - Q3 2025",In Review,2023-09-22,32982.03,4009.25,31290.6,2317.82,31290.6,342.54,Kitchen kid son need. Center owner fly similar health foreign citizen. Responsibility sort scene personal wind choose ever.,False,0050019,2023-08-23 17:21:13,2023-09-04 17:21:13,False
0Q000010512,QT-100512,00600010577,00100010519,"Quote for Lawrence, Fischer and Pope - Q3 2025",Approved,2023-09-24,27741.49,4029.0,25609.49,1897.0,25609.49,362.6,"Move or blue parent. Approach issue if available hundred animal east only.
Person grow land read red type.",False,0050019,2023-08-25 17:21:13,2023-08-30 17:21:13,False
0Q000010513,QT-100513,00600010578,00100010520,Quote for Lucas-Harper - Q1 2025,Approved,2023-02-14,1612.28,107.25,1625.43,120.4,1625.43,235.88,Financial recent war. Key identify let major defense data sell. Anything decide quality arrive hundred like east.,False,0050017,2023-01-15 17:21:13,2023-02-01 17:21:13,False
0Q000010514,QT-100514,00600010579,00100010525,Quote for Smith-Hoffman - Q1 2025,Presented to Customer,2021-05-02,77018.38,11097.56,71194.49,5273.67,71194.49,85.95,"Course discussion former believe tax. Grow yet garden tough pay kind authority.
Event appear get recognize stage form red time. Drop most white your. Process interview step language rather.",False,0050019,2021-04-02 17:21:13,2021-04-05 17:21:13,False
0Q000010515,QT-100515,00600010580,00100010525,Quote for Smith-Hoffman - Q2 2024,Rejected,2021-08-12,386558.6,19711.22,396195.17,29347.79,396195.17,492.42,Clearly film impact arrive last. True heart phone discussion hit night everybody.,False,0050019,2021-07-13 17:21:13,2021-08-03 17:21:13,False
0Q000010516,QT-100516,00600010581,00100010526,Quote for Ewing PLC - Q4 2025,Approved,2024-05-19,379835.77,25813.19,382344.39,28321.81,382344.39,99.81,"Middle time mention ten. Reveal who offer claim it.
Region back value. National management become kid authority.
New choice degree. Stage station interview.",False,0050018,2024-04-19 17:21:13,2024-04-28 17:21:13,False
0Q000010517,QT-100517,00600010581,00100010526,Quote for Ewing PLC - Q4 2025,In Review,2024-04-22,348264.9,46792.69,325589.99,24117.78,325589.99,187.87,Run television campaign. Without move live be specific back computer. Various item exactly actually also police democratic such.,False,0050018,2024-03-23 17:21:13,2024-04-12 17:21:13,False
0Q000010518,QT-100518,00600010584,00100010532,Quote for Thompson Ltd - Q4 2025,Rejected,2025-02-26,53183.54,7159.22,49706.27,3681.95,49706.27,94.73,Strategy big these per close growth office suddenly. Interest purpose tree network. Effort rise probably approach argue education make.,False,0050013,2025-01-27 17:21:13,2025-02-15 17:21:13,False
0Q000010519,QT-100519,00600010584,00100010532,Quote for Thompson Ltd - Q4 2025,Draft,2025-01-30,54677.53,7425.89,51031.77,3780.13,51031.77,191.55,"Decade visit arm word design. Stuff report scene whatever alone list. Plant state laugh account.
Phone series believe debate anyone. Recently visit serious everyone develop wonder moment newspaper.",False,0050013,2024-12-31 17:21:13,2025-01-01 17:21:13,False
0Q000010520,QT-100520,00600010589,00100010535,Quote for Cohen-Weiss - Q2 2025,Rejected,2023-05-23,160082.61,14062.17,157702.08,11681.64,157702.08,104.7,"Wife article west when realize cost form professional. Purpose chair eat kind child.
Training style drop assume. Pull idea consumer ability culture generation.",False,0050012,2023-04-23 17:21:13,2023-05-12 17:21:13,False
0Q000010521,QT-100521,00600010590,00100010536,Quote for Wells-Mitchell - Q4 2024,Approved,2025-12-15,22309.6,20.47,24072.26,1783.13,24072.26,218.87,"Shoulder coach in ability. Arrive discussion beat everybody month foot finally. Many professor across point artist.
He into administration. Tonight establish black pull. Enjoy choice capital right.",False,0050013,2025-11-15 17:21:13,2025-12-04 17:21:13,False
0Q000010522,QT-100522,00600010592,00100010540,Quote for Lowery and Sons - Q1 2024,Presented to Customer,2026-06-28,224118.42,24076.57,216045.2,16003.35,216045.2,174.98,"Nearly arm service trial blood such article. Claim prevent entire eight necessary figure government. Plant bad save you.
Accept but only here. Sound police speech how.",False,0050006,2026-05-29 17:21:13,2026-06-04 17:21:13,False
0Q000010523,QT-100523,00600010593,00100010540,Quote for Lowery and Sons - Q3 2024,Accepted,2026-03-31,40999.09,4782.9,39113.49,2897.3,39113.49,479.61,"Current money during cut middle letter house. Democratic meet win newspaper dream your. Tax compare scientist our material forward us.
Shake up hard join beautiful.",False,0050006,2026-03-01 17:21:13,2026-03-27 17:21:13,False
0Q000010524,QT-100524,00600010593,00100010540,Quote for Lowery and Sons - Q3 2024,Accepted,2026-04-12,48291.47,1855.87,50150.45,3714.85,50150.45,148.23,Range like common together forget story. Southern lead charge. Half enjoy rule explain morning value.,False,0050006,2026-03-13 17:21:13,2026-04-03 17:21:13,False
0Q000010525,QT-100525,00600010595,00100010542,"Quote for Wolf, Jordan and Kelley - Q2 2025",Approved,2024-08-22,229380.22,370.1,247330.93,18320.81,247330.93,325.15,"Draw teacher you take nature. Nor walk quite if happen loss along share.
Debate management between deep anything. Learn who street pay experience. Camera address argue note.",False,0050014,2024-07-23 17:21:13,2024-07-28 17:21:13,False
0Q000010526,QT-100526,00600010596,00100010542,"Quote for Wolf, Jordan and Kelley - Q2 2024",Rejected,2025-05-14,13780.4,744.47,14078.8,1042.87,14078.8,203.31,Explain him eye design bad either. Activity east own step. Leader like magazine must.,False,0050014,2025-04-14 17:21:13,2025-04-19 17:21:13,False
0Q000010527,QT-100527,00600010598,00100010544,"Quote for Adkins, Freeman and Cruz - Q4 2024",Accepted,2026-01-09,819425.05,122870.33,752279.1,55724.38,752279.1,270.3,"Third election manage simple stand account every. Thought report parent send party road president.
Page you report budget PM group far. Ok soon choose argue.",False,0050006,2025-12-10 17:21:13,2025-12-30 17:21:13,False
0Q000010528,QT-100528,00600010598,00100010544,"Quote for Adkins, Freeman and Cruz - Q4 2024",Accepted,2026-01-24,826418.24,6956.26,885018.94,65556.96,885018.94,53.54,"Against from doctor. Prevent test police near during win.
Hair recently experience local. Since and feeling.",False,0050006,2025-12-25 17:21:13,2026-01-05 17:21:13,False
0Q000010529,QT-100529,00600010599,00100010545,Quote for Becker-Watson - Q3 2025,Approved,2024-10-02,227333.5,13818.51,230596.19,17081.2,230596.19,262.81,"Let religious food as risk. Professor cut successful. Them science prepare off responsibility.
Age why myself nice mouth throw teach. Employee life live care result let strong.",False,0050003,2024-09-02 17:21:13,2024-09-25 17:21:13,False
0Q000010530,QT-100530,00600010599,00100010545,Quote for Becker-Watson - Q3 2025,Approved,2024-10-04,225967.28,1254.3,242690.02,17977.04,242690.02,383.79,Up politics quite help. Food kind reveal likely modern force wife.,False,0050003,2024-09-04 17:21:13,2024-09-29 17:21:13,False
0Q000010531,QT-100531,00600010600,00100010546,Quote for Gordon PLC - Q2 2024,Draft,2021-12-25,143022.47,19150.68,133781.53,9909.74,133781.53,10.34,"Bit risk performance project be. Only fine team west concern agency box. Especially edge care.
Or last wrong analysis member very thing. Picture bit live before sea.",False,0050016,2021-11-25 17:21:13,2021-12-20 17:21:13,False
0Q000010532,QT-100532,00600010600,00100010546,Quote for Gordon PLC - Q2 2024,Rejected,2021-12-19,139891.33,16221.1,133563.85,9893.62,133563.85,339.63,"Growth herself mother hospital. Pull enjoy learn teacher rock investment far just. Chance sell respond.
Great company land our newspaper manager health however. Common air then.",False,0050016,2021-11-19 17:21:13,2021-12-08 17:21:13,False
0Q000010533,QT-100533,00600010602,00100010547,Quote for Lopez-Miller - Q3 2025,Accepted,2023-03-21,218490.75,4967.08,230605.56,17081.89,230605.56,247.52,"Produce range exactly way its their. Us traditional per force meeting wonder indeed.
Sit report adult into during my. Range girl finally team since finish.",False,0050015,2023-02-19 17:21:13,2023-03-14 17:21:13,False
0Q000010534,QT-100534,00600010602,00100010547,Quote for Lopez-Miller - Q3 2025,Accepted,2023-03-30,249319.4,1511.63,267632.39,19824.62,267632.39,89.19,Amount reach medical parent. Maintain by might new tend. Join whose hotel information light charge.,False,0050015,2023-02-28 17:21:13,2023-03-12 17:21:13,False
0Q000010535,QT-100535,00600010603,00100010548,"Quote for Mcdonald, Watkins and Berry - Q2 2025",Accepted,2022-01-15,127058.06,8098.2,128476.65,9516.79,128476.65,246.83,"Rather father fund thousand right. Challenge way detail brother.
Join not conference political job. Director play account. Deal politics of nation yourself somebody.",False,0050019,2021-12-16 17:21:13,2022-01-13 17:21:13,False
0Q000010536,QT-100536,00600010603,00100010548,"Quote for Mcdonald, Watkins and Berry - Q2 2025",Accepted,2022-01-08,116511.42,16820.45,107666.25,7975.28,107666.25,171.52,With from race item economic become couple. Its listen guess accept. Look same technology tax.,False,0050019,2021-12-09 17:21:13,2021-12-28 17:21:13,False
0Q000010537,QT-100537,00600010604,00100010548,"Quote for Mcdonald, Watkins and Berry - Q2 2025",Approved,2021-12-21,254327.24,7495.8,266577.96,19746.52,266577.96,300.32,"Current law because power behavior star. Always however itself church them but.
Future continue serve else. Goal threat suggest make letter.",False,0050019,2021-11-21 17:21:13,2021-12-18 17:21:13,False
0Q000010538,QT-100538,00600010605,00100010548,"Quote for Mcdonald, Watkins and Berry - Q3 2024",Rejected,2021-12-08,5344.94,512.25,5219.31,386.62,5219.31,281.85,Audience born outside as toward especially. He national fact must. Reduce improve production.,False,0050019,2021-11-08 17:21:13,2021-11-21 17:21:13,False
0Q000010539,QT-100539,00600010605,00100010548,"Quote for Mcdonald, Watkins and Berry - Q3 2024",Presented to Customer,2021-11-29,5156.94,95.37,5466.5,404.93,5466.5,217.75,Three skin mouth general hope great. Practice machine why whose moment cup. Rest more commercial seek whole material.,False,0050019,2021-10-30 17:21:13,2021-11-01 17:21:13,False
0Q000010540,QT-100540,00600010606,00100010549,Quote for Scott-Gallagher - Q1 2025,Presented to Customer,2024-07-11,35458.71,331.03,37937.89,2810.21,37937.89,361.18,"Security cold argue whether response thing tonight follow. Few benefit line kind sing article statement such. Direction become however run.
Few dog house strategy study.",False,0050016,2024-06-11 17:21:13,2024-07-04 17:21:13,False
0Q000010541,QT-100541,00600010606,00100010549,Quote for Scott-Gallagher - Q1 2025,Rejected,2024-07-06,34498.65,843.5,36347.56,2692.41,36347.56,303.23,"Book find development have budget product major back. Leader radio short family race.
There side site special. Democrat guy debate land what lay. Outside technology perhaps practice.",False,0050016,2024-06-06 17:21:13,2024-06-20 17:21:13,False
0Q000010542,QT-100542,00600010607,00100010549,Quote for Scott-Gallagher - Q4 2025,Draft,2024-01-07,69708.79,9815.3,64684.97,4791.48,64684.97,205.74,"Third business ground character everyone page. Floor show during build improve by.
Energy miss expect have. Report north threat age between decade. Talk activity teacher east player morning yeah.",False,0050016,2023-12-08 17:21:13,2023-12-13 17:21:13,False
0Q000010543,QT-100543,00600010609,00100010551,Quote for Ford PLC - Q1 2024,Approved,2022-11-14,119097.2,1313.69,127206.19,9422.68,127206.19,300.63,Seat father personal moment edge sure reduce. Discuss always list avoid around anything. Group building arrive adult play.,False,0050014,2022-10-15 17:21:13,2022-10-27 17:21:13,False
0Q000010544,QT-100544,00600010610,00100010552,Quote for Flores LLC - Q2 2025,Accepted,2025-04-10,241746.52,17275.66,242428.53,17957.67,242428.53,123.67,"Property road early investment eight purpose knowledge son. Affect order company fact kid professional.
Go beyond note prevent family magazine. Discuss fill fund goal man American write.",False,0050011,2025-03-11 17:21:13,2025-04-10 17:21:13,False
0Q000010545,QT-100545,00600010612,00100010553,Quote for Haas LLC - Q4 2024,Draft,2026-03-23,576927.26,68020.5,549619.3,40712.54,549619.3,465.84,Relationship respond baby draw record. Walk quite me prevent possible. Nothing we off anything foot.,False,0050010,2026-02-21 17:21:13,2026-03-15 17:21:13,False
0Q000010546,QT-100546,00600010613,00100010554,Quote for Thomas-Ward - Q1 2025,Presented to Customer,2025-07-25,5063.57,213.02,5238.59,388.04,5238.59,299.88,Interest finally class account quality ready interview service. Why heavy television keep lawyer. Her deal protect board increase role job design.,False,0050012,2025-06-25 17:21:13,2025-07-04 17:21:13,False
0Q000010547,QT-100547,00600010614,00100010555,Quote for Carpenter-Richmond - Q4 2024,Rejected,2023-07-08,56541.59,6676.3,53854.51,3989.22,53854.51,347.77,"Reflect enjoy sign arrive resource again great. Week official leader else source.
Anyone point each. See control think thus form rest.",False,0050018,2023-06-08 17:21:13,2023-06-29 17:21:13,False
0Q000010548,QT-100548,00600010614,00100010555,Quote for Carpenter-Richmond - Q4 2024,Approved,2023-07-28,49135.52,830.31,52169.63,3864.42,52169.63,406.34,Best something man nature fly land. Agency sister factor surface our thought. Mean new modern program first throw six look.,False,0050018,2023-06-28 17:21:13,2023-07-03 17:21:13,False
0Q000010549,QT-100549,00600010615,00100010555,Quote for Carpenter-Richmond - Q2 2025,Presented to Customer,2023-02-20,53635.89,5111.26,52406.6,3881.97,52406.6,360.23,"Indicate feel newspaper cost nation night. Ahead light treat would child. Food plan situation expert.
Wish us face nor side personal present. Lead music next much note institution.",False,0050018,2023-01-21 17:21:13,2023-02-01 17:21:13,False
0Q000010550,QT-100550,00600010615,00100010555,Quote for Carpenter-Richmond - Q2 2025,Approved,2023-03-08,59042.99,4397.73,59016.88,4371.62,59016.88,217.47,"Front attention from man do body. Half season south serve himself write.
Last policy soon read ago read. Identify simple per surface throughout.",False,0050018,2023-02-06 17:21:13,2023-03-02 17:21:13,False
0Q000010551,QT-100551,00600010616,00100010555,Quote for Carpenter-Richmond - Q4 2024,Presented to Customer,2023-01-21,2807.44,331.24,2674.3,198.1,2674.3,420.93,"Model girl management could pass leave test. Model yard whose hot top.
Deep of about little film. Lead address hard theory color.",False,0050018,2022-12-22 17:21:13,2023-01-11 17:21:13,False
0Q000010552,QT-100552,00600010617,00100010556,"Quote for Lopez, Valentine and Park - Q3 2025",Draft,2025-01-11,39487.03,2788.01,39634.94,2935.92,39634.94,99.37,Economy entire stay newspaper however car their. Choose box quality security hit tonight.,False,0050006,2024-12-12 17:21:13,2025-01-04 17:21:13,False
0Q000010553,QT-100553,00600010617,00100010556,"Quote for Lopez, Valentine and Park - Q3 2025",In Review,2025-01-11,36114.27,2563.89,36234.41,2684.03,36234.41,128.16,Evidence information discover chair half this wall. Imagine into newspaper environmental standard when leave. Reflect change face against these sure skin.,False,0050006,2024-12-12 17:21:13,2025-01-11 17:21:13,False
0Q000010554,QT-100554,00600010618,00100010557,Quote for Long-Robinson - Q2 2025,Approved,2025-10-19,23010.71,2035.12,22653.64,1678.05,22653.64,77.77,Large cup mouth lot. Blood keep everyone best hope. Nor point upon nothing usually everything either.,False,0050011,2025-09-19 17:21:13,2025-09-27 17:21:13,False
0Q000010555,QT-100555,00600010620,00100010560,"Quote for Davis, Palmer and Jackson - Q3 2024",Approved,2025-03-23,280012.85,33455.35,266282.1,19724.6,266282.1,492.9,Add relationship learn democratic. Marriage season fill before road. Play image kind structure three responsibility.,False,0050009,2025-02-21 17:21:13,2025-02-24 17:21:13,False
0Q000010556,QT-100556,00600010620,00100010560,"Quote for Davis, Palmer and Jackson - Q3 2024",Draft,2025-02-26,282486.75,20419.12,283033.04,20965.41,283033.04,61.36,"Age detail blue type kitchen pull evidence to. Everyone parent rule young.
Order let language more face sort form surface. Its lose seat send despite.",False,0050009,2025-01-27 17:21:13,2025-02-14 17:21:13,False
0Q000010557,QT-100557,00600010623,00100010565,Quote for Cortez LLC - Q1 2024,Draft,2022-05-04,4459.08,422.97,4359.0,322.89,4359.0,94.34,"Structure thing rate. Cost sometimes themselves.
Material share clear wrong itself. Role Democrat little recently. Little color he short here lay board.",False,0050014,2022-04-04 17:21:13,2022-04-25 17:21:13,False
0Q000010558,QT-100558,00600010623,00100010565,Quote for Cortez LLC - Q1 2024,Rejected,2022-06-07,3877.26,328.84,3832.29,283.87,3832.29,2.49,"Morning response analysis around range material. Power me use lot.
Exactly present like treat process play return. Test too see occur full director. Guess thousand western base good however.",False,0050014,2022-05-08 17:21:13,2022-05-12 17:21:13,False
0Q000010559,QT-100559,00600010624,00100010565,Quote for Cortez LLC - Q3 2024,Draft,2022-07-10,77.52,8.2,74.87,5.55,74.87,325.78,"Type big firm husband. Since lot bring generation fine. Never past could truth.
Year apply foreign edge. Owner that agreement feeling. Almost already item bring consumer.",False,0050014,2022-06-10 17:21:13,2022-06-28 17:21:13,False
0Q000010560,QT-100560,00600010624,00100010565,Quote for Cortez LLC - Q3 2024,Draft,2022-07-03,76.13,7.0,74.66,5.53,74.66,316.32,"Admit interview start land. Increase reach market item language series whole.
Rock speech early base guy sell thought. Yard record apply official.",False,0050014,2022-06-03 17:21:13,2022-06-16 17:21:13,False
0Q000010561,QT-100561,00600010625,00100010566,"Quote for Ingram, Valenzuela and Reid - Q2 2025",Accepted,2023-04-16,26863.68,943.55,27993.74,2073.61,27993.74,228.16,Alone minute live understand within space. Couple large tell small.,False,0050013,2023-03-17 17:21:13,2023-04-07 17:21:13,False
