Id,QuoteNumber,OpportunityId,AccountId,Name,Status,ExpirationDate,Subtotal,Discount,TotalPrice,Tax,GrandTotal,ShippingHandling,Description,IsSyncing,OwnerId,CreatedDate,LastModifiedDate,IsDeleted
0Q000010701,QT-100701,00600010775,00100010711,Quote for Johnson-Day - Q1 2025,Approved,2021-11-10,1058152.01,20232.42,1120953.16,83033.57,1120953.16,135.06,Family tell drive ever within particular. Himself house we yeah family area public.,False,0050011,2021-10-11 17:21:13,2021-10-22 17:21:13,False
0Q000010702,QT-100702,00600010776,00100010712,"Quote for Edwards, Dean and Wheeler - Q4 2025",In Review,2024-04-05,46553.46,5471.11,44368.94,3286.59,44368.94,284.09,"Big body leg instead.
The though control goal bed film phone. Allow the event talk nor teacher. Early full walk movie natural would good.
Her firm amount game. Foreign final situation send.",False,0050013,2024-03-06 17:21:13,2024-03-25 17:21:13,False
0Q000010703,QT-100703,00600010778,00100010714,Quote for Callahan Inc - Q3 2024,Presented to Customer,2021-11-28,287744.18,1645.7,308986.36,22887.88,308986.36,111.69,"Now staff special order. Ground feel picture give might meeting amount.
Think fine oil drug wait standard answer build. Analysis occur strategy where tough return campaign.",False,0050016,2021-10-29 17:21:13,2021-11-18 17:21:13,False
0Q000010704,QT-100704,00600010779,00100010715,Quote for Marks Inc - Q3 2025,Presented to Customer,2022-01-18,217564.78,4379.46,230240.15,17054.83,230240.15,179.09,Hot organization quickly PM hot dinner. None rise back degree.,False,0050017,2021-12-19 17:21:13,2021-12-22 17:21:13,False
0Q000010705,QT-100705,00600010780,00100010716,Quote for Mcbride Group - Q4 2025,In Review,2023-04-03,185476.92,7673.2,192028.02,14224.3,192028.02,395.11,"Cell court sing. Put population several. Beyond sure this those.
Exist above time anything few stock. Art treatment relationship. In follow soldier firm defense.",False,0050013,2023-03-04 17:21:13,2023-03-22 17:21:13,False
0Q000010706,QT-100706,00600010780,00100010716,Quote for Mcbride Group - Q4 2025,Draft,2023-04-05,207999.1,27103.22,195367.55,14471.67,195367.55,182.18,"Investment two when score fish rate. Same those pull guess price east term.
Indeed system prove strategy development forget else girl. Another way include yourself be imagine.",False,0050013,2023-03-06 17:21:13,2023-03-10 17:21:13,False
0Q000010707,QT-100707,00600010781,00100010716,Quote for Mcbride Group - Q3 2024,Approved,2023-01-18,61057.61,3727.62,61916.39,4586.4,61916.39,412.5,Hotel economic break herself cover wish. Include total prevent anyone. Realize military image age listen laugh answer rock.,False,0050013,2022-12-19 17:21:13,2022-12-20 17:21:13,False
0Q000010708,QT-100708,00600010781,00100010716,Quote for Mcbride Group - Q3 2024,Approved,2023-03-03,60105.76,628.28,64235.68,4758.2,64235.68,303.28,Area authority land leave dream home performance require. Person short loss across else friend environment. Especially side determine throw. Scientist tend control pressure.,False,0050013,2023-02-01 17:21:13,2023-02-28 17:21:13,False
0Q000010709,QT-100709,00600010782,00100010718,Quote for Andrews-Carter - Q4 2024,Presented to Customer,2022-03-23,91310.86,7032.3,91020.85,6742.29,91020.85,188.86,"Majority along show decision technology ask hair. Response second hand despite movie expert economy.
Conference role where fill town staff. Important young someone husband no.",False,0050013,2022-02-21 17:21:13,2022-03-19 17:21:13,False
0Q000010710,QT-100710,00600010782,00100010718,Quote for Andrews-Carter - Q4 2024,Presented to Customer,2022-03-16,93017.44,10492.77,89126.64,6601.97,89126.64,215.04,Require drug detail deep age participant clearly. Common themselves above anything challenge. Mr he audience pull. Article break low.,False,0050013,2022-02-14 17:21:13,2022-02-22 17:21:13,False
0Q000010711,QT-100711,00600010786,00100010721,"Quote for Patrick, Villarreal and Herrera - Q2 2025",Approved,2025-01-24,199981.9,8828.45,206445.73,15292.28,206445.73,417.84,"Suffer term fly role anything. Attack financial discover listen.
Expert debate capital black soon top treat military. Themselves trip question. Send happen concern tax include.",False,0050006,2024-12-25 17:21:13,2025-01-16 17:21:13,False
0Q000010712,QT-100712,00600010786,00100010721,"Quote for Patrick, Villarreal and Herrera - Q2 2025",Presented to Customer,2025-01-20,193217.63,16293.32,191078.26,14153.95,191078.26,474.28,Guy career forward sort throw kind. Style generation last determine with happen him. Out television campaign seek.,False,0050006,2024-12-21 17:21:13,2024-12-27 17:21:13,False
0Q000010713,QT-100713,00600010787,00100010724,Quote for Jennings-Bennett - Q4 2025,Approved,2022-10-25,2200.49,269.49,2085.48,154.48,2085.48,388.91,But language get church cold wife hospital. Democrat information eat moment quite. Play under cost second impact.,False,0050004,2022-09-25 17:21:13,2022-10-16 17:21:13,False
0Q000010714,QT-100714,00600010788,00100010724,Quote for Jennings-Bennett - Q3 2024,In Review,2022-12-22,2693.96,36.86,2869.67,212.57,2869.67,75.18,Goal down level oil will five must century. Class chair need street agency culture already.,False,0050004,2022-11-22 17:21:13,2022-12-17 17:21:13,False
0Q000010715,QT-100715,00600010790,00100010728,"Quote for Chapman, Thomas and Davis - Q2 2025",Approved,2021-11-05,74909.21,8097.72,72156.41,5344.92,72156.41,11.59,Reveal authority it national shoulder. Nice whose imagine student party whole. Animal way single moment scene threat war. Blood city say individual.,False,0050007,2021-10-06 17:21:13,2021-11-05 17:21:13,False
0Q000010716,QT-100716,00600010791,00100010729,"Quote for Thompson, White and Gray - Q3 2024",Presented to Customer,2026-03-08,17399.78,1109.17,17593.86,1303.25,17593.86,199.68,"Hospital learn yes employee field ten other. View able staff.
Understand find maintain near tax pick. Look look action property kind bit. Star service different green daughter.",False,0050013,2026-02-06 17:21:13,2026-02-22 17:21:13,False
0Q000010717,QT-100717,00600010791,00100010729,"Quote for Thompson, White and Gray - Q3 2024",Approved,2026-03-28,16446.03,684.79,17022.14,1260.9,17022.14,327.47,"Should full daughter popular past admit. Support energy specific possible dark pretty.
Through society Mrs. Fear court else apply effect.
Player place month speech PM spring effect.",False,0050013,2026-02-26 17:21:13,2026-03-13 17:21:13,False
0Q000010718,QT-100718,00600010792,00100010731,Quote for Powell PLC - Q1 2025,Rejected,2025-12-25,5852.11,0.73,6319.49,468.11,6319.49,435.62,Accept there strategy smile raise real. Foot concern report body old whether figure to.,False,0050019,2025-11-25 17:21:13,2025-12-02 17:21:13,False
0Q000010719,QT-100719,00600010795,00100010733,Quote for Garcia PLC - Q1 2025,Presented to Customer,2025-02-13,177481.35,10289.63,180567.06,13375.34,180567.06,45.86,Wind everybody population range political usually. Offer modern them improve leave carry can clearly.,False,0050017,2025-01-14 17:21:13,2025-01-17 17:21:13,False
0Q000010720,QT-100720,00600010796,00100010733,Quote for Garcia PLC - Q4 2025,Approved,2025-06-24,174678.02,22462.0,164393.3,12177.28,164393.3,62.21,"Research scientist water question head.
Pattern lay home enough. Success girl painting from many space.",False,0050017,2025-05-25 17:21:13,2025-06-23 17:21:13,False
0Q000010721,QT-100721,00600010797,00100010734,Quote for Sanders-Gonzalez - Q4 2024,Accepted,2026-04-03,874660.6,92990.69,844203.5,62533.59,844203.5,136.47,Movie realize eye for chair cold. Couple least into no. Personal street know any think travel.,False,0050019,2026-03-04 17:21:13,2026-03-21 17:21:13,False
0Q000010722,QT-100722,00600010798,00100010735,Quote for Davis-Ortiz - Q1 2025,Presented to Customer,2021-08-27,69886.25,9720.32,64979.2,4813.27,64979.2,162.68,Available traditional owner for scene election this. Four help civil picture. Vote usually support.,False,0050018,2021-07-28 17:21:13,2021-07-30 17:21:13,False
0Q000010723,QT-100723,00600010798,00100010735,Quote for Davis-Ortiz - Q1 2025,Approved,2021-08-08,72251.65,4815.9,72830.61,5394.86,72830.61,138.08,"Walk apply win national. Process make say article fish. Recognize he dark story scene animal provide.
Use phone benefit deep hit until sound. Building car subject remain.",False,0050018,2021-07-09 17:21:13,2021-07-22 17:21:13,False
0Q000010724,QT-100724,00600010799,00100010735,Quote for Davis-Ortiz - Q1 2025,Presented to Customer,2021-08-09,305019.99,36211.87,290312.77,21504.65,290312.77,206.39,"Evidence pass nearly near physical decide short Democrat. Heavy employee direction good. Candidate blood six until.
Later yeah challenge lot foreign. Movie evening add.",False,0050018,2021-07-10 17:21:13,2021-08-03 17:21:13,False
0Q000010725,QT-100725,00600010802,00100010740,Quote for Jones-Kelley - Q4 2025,Presented to Customer,2021-12-18,32565.6,1782.68,33245.55,2462.63,33245.55,36.96,At moment place. Throughout if someone sister play if watch. Billion make office shake realize piece.,False,0050016,2021-11-18 17:21:13,2021-11-19 17:21:13,False
0Q000010726,QT-100726,00600010802,00100010740,Quote for Jones-Kelley - Q4 2025,In Review,2021-12-16,38954.78,5235.06,36417.3,2697.58,36417.3,28.05,Just life along thus. Instead food stock lot not. Want space run might fact same. Bill couple spring above back.,False,0050016,2021-11-16 17:21:13,2021-11-17 17:21:13,False
0Q000010727,QT-100727,00600010803,00100010740,Quote for Jones-Kelley - Q3 2024,Accepted,2022-10-05,463563.28,16399.54,482936.84,35773.1,482936.84,1.11,"Early than worker town number over.
Role he relate. Traditional leg front claim fire box. Party away capital theory none.",False,0050016,2022-09-05 17:21:13,2022-09-23 17:21:13,False
0Q000010728,QT-100728,00600010805,00100010742,"Quote for Sosa, Fisher and White - Q1 2025",Accepted,2023-07-25,60651.05,3795.52,61403.97,4548.44,61403.97,54.61,"See matter skin anything. Loss drug happy rise support day.
Along nor clearly you be four. International exist level. Mind produce television series officer prepare former receive.",False,0050005,2023-06-25 17:21:13,2023-06-27 17:21:13,False
0Q000010729,QT-100729,00600010805,00100010742,"Quote for Sosa, Fisher and White - Q1 2025",Accepted,2023-07-17,61780.61,7193.27,58954.33,4366.99,58954.33,149.82,"Skin fire million order prepare need. Ability focus son remain.
Respond participant cell career central before more. Hour research instead church Republican bring shoulder author.",False,0050005,2023-06-17 17:21:13,2023-06-30 17:21:13,False
0Q000010730,QT-100730,00600010806,00100010742,"Quote for Sosa, Fisher and White - Q4 2024",Rejected,2024-03-02,143641.01,10873.16,143389.28,10621.43,143389.28,55.88,"Throughout model fire quite more. High service in three. Begin travel edge floor number upon buy.
Myself letter already share. Moment hospital speech whatever reach. Final stage up address party.",False,0050005,2024-02-01 17:21:13,2024-02-12 17:21:13,False
0Q000010731,QT-100731,00600010806,00100010742,"Quote for Sosa, Fisher and White - Q4 2024",Presented to Customer,2024-04-08,157632.24,9043.0,160476.38,11887.14,160476.38,329.48,Usually serious piece. Blue defense growth interest increase generation. Conference thought a reason. Risk position represent research partner husband add account.,False,0050005,2024-03-09 17:21:13,2024-03-20 17:21:13,False
0Q000010732,QT-100732,00600010807,00100010742,"Quote for Sosa, Fisher and White - Q1 2025",Accepted,2024-01-13,146289.28,15901.71,140818.58,10431.01,140818.58,250.57,"Career value class two scene. Seven ever source arrive wait edge plan. Deep teach assume wide energy.
Car opportunity job respond.",False,0050005,2023-12-14 17:21:13,2024-01-03 17:21:13,False
0Q000010733,QT-100733,00600010807,00100010742,"Quote for Sosa, Fisher and White - Q1 2025",Accepted,2024-02-04,142777.23,20290.54,132285.63,9798.94,132285.63,235.72,Yeah any employee behavior poor statement word responsibility. Billion find term to bring.,False,0050005,2024-01-05 17:21:13,2024-01-31 17:21:13,False
0Q000010734,QT-100734,00600010808,00100010743,Quote for Thompson and Sons - Q4 2024,Accepted,2025-08-31,267307.55,28919.56,257459.03,19071.04,257459.03,148.46,"Baby camera process when. Coach sense talk tonight environment anyone.
Address military college throw answer practice large. Wrong natural simple yourself mean.",False,0050016,2025-08-01 17:21:13,2025-08-06 17:21:13,False
0Q000010735,QT-100735,00600010809,00100010743,Quote for Thompson and Sons - Q1 2025,Accepted,2025-07-07,36711.54,2637.89,36799.54,2725.89,36799.54,199.52,"Base today mean. Couple include yeah appear.
Save something century baby contain ability. Argue line receive word.
Thought opportunity every compare free president.",False,0050016,2025-06-07 17:21:13,2025-06-17 17:21:13,False
0Q000010736,QT-100736,00600010810,00100010743,Quote for Thompson and Sons - Q1 2024,In Review,2025-06-26,21033.13,2953.45,19526.05,1446.37,19526.05,256.85,"Campaign sometimes report by. Like stuff measure form. Instead investment state.
Third hold bit policy allow lay relationship office. Challenge century note organization defense. Whom customer I end.",False,0050016,2025-05-27 17:21:13,2025-06-20 17:21:13,False
0Q000010737,QT-100737,00600010811,00100010744,Quote for Mclean Inc - Q1 2024,Accepted,2022-02-12,4411.12,178.27,4571.48,338.63,4571.48,401.36,Between activity young religious early senior. Final particular play security individual operation argue. Front glass wrong minute whole. Sea language action street.,False,0050014,2022-01-13 17:21:13,2022-02-03 17:21:13,False
0Q000010738,QT-100738,00600010812,00100010745,Quote for Thompson Ltd - Q4 2025,Presented to Customer,2022-03-13,9101.47,1041.97,8704.26,644.76,8704.26,157.11,"Clear movie lay experience heavy foot. Matter claim team goal adult past make.
Concern fight town tend do soldier protect.
Appear half herself dinner design design.",False,0050015,2022-02-11 17:21:13,2022-03-09 17:21:13,False
0Q000010739,QT-100739,00600010816,00100010750,"Quote for Taylor, Anderson and Turner - Q2 2024",Rejected,2023-06-29,22660.55,138.07,24324.28,1801.8,24324.28,180.52,Position down chair discover attorney successful. The break hair however author.,False,0050005,2023-05-30 17:21:13,2023-06-09 17:21:13,False
0Q000010740,QT-100740,00600010816,00100010750,"Quote for Taylor, Anderson and Turner - Q2 2024",Draft,2023-06-30,22641.57,1282.54,23067.75,1708.72,23067.75,115.41,"Drive rather better pull note often. Night great left attorney black.
Job front Democrat house there chance. Center well section we military.",False,0050005,2023-05-31 17:21:13,2023-06-02 17:21:13,False
0Q000010741,QT-100741,00600010817,00100010750,"Quote for Taylor, Anderson and Turner - Q1 2025",Approved,2023-07-11,26954.4,2449.93,26464.83,1960.36,26464.83,173.94,Wish point term green expect. As career who pay expect sign. Me yet newspaper two best ever collection.,False,0050005,2023-06-11 17:21:13,2023-07-10 17:21:13,False
0Q000010742,QT-100742,00600010819,00100010753,"Quote for Kemp, Barnes and Martinez - Q3 2025",Accepted,2024-10-13,142211.36,8138.74,144798.43,10725.81,144798.43,370.97,"Wall eye wish message compare truth. Will myself fact who.
Specific nice popular. Tree government international matter before.",False,0050004,2024-09-13 17:21:13,2024-09-22 17:21:13,False
0Q000010743,QT-100743,00600010819,00100010753,"Quote for Kemp, Barnes and Martinez - Q3 2025",Accepted,2024-09-13,124186.56,15112.07,117800.45,8725.96,117800.45,341.5,"Win dream enter production agency assume ever fact. Employee for challenge onto young. From measure control voice interest.
Buy effort professor home concern sense system hour.",False,0050004,2024-08-14 17:21:13,2024-09-05 17:21:13,False
0Q000010744,QT-100744,00600010821,00100010754,Quote for Melton Group - Q1 2024,Approved,2024-02-06,78619.31,8366.55,75872.98,5620.22,75872.98,15.81,"Run question modern. Include per quickly recently.
Possible place hold range recognize. Staff create institution get toward assume news.",False,0050006,2024-01-07 17:21:13,2024-02-04 17:21:13,False
0Q000010745,QT-100745,00600010823,00100010755,"Quote for Sims, York and James - Q1 2024",Rejected,2024-08-03,369417.7,28342.78,368360.91,27285.99,368360.91,482.32,Brother somebody data seek over. All specific child gun conference project interview.,False,0050013,2024-07-04 17:21:13,2024-07-20 17:21:13,False
0Q000010746,QT-100746,00600010824,00100010760,Quote for Johnson-Tyler - Q4 2024,Accepted,2025-06-08,25125.89,712.21,26366.77,1953.09,26366.77,356.27,"Past also beat us. Public majority remember ability push how heavy customer. Pressure over green century partner sing.
Song teach nature mouth with once at. Whatever reach church more.",False,0050003,2025-05-09 17:21:13,2025-05-26 17:21:13,False
0Q000010747,QT-100747,00600010825,00100010760,Quote for Johnson-Tyler - Q3 2024,Approved,2024-11-01,163637.56,20627.64,154450.71,11440.79,154450.71,105.14,"Such north purpose decade positive trial. Name glass lose rock responsibility any everything possible.
Sea right power offer medical. Congress hour management keep.",False,0050003,2024-10-02 17:21:13,2024-10-16 17:21:13,False
0Q000010748,QT-100748,00600010827,00100010761,Quote for Odonnell and Sons - Q1 2025,Presented to Customer,2026-08-27,14990.39,2003.9,14025.41,1038.92,14025.41,31.56,"Join somebody early according detail. One fire capital building.
Along week whatever bill mouth edge. Writer up right western.",False,0050016,2026-07-28 17:21:13,2026-08-11 17:21:13,False
0Q000010749,QT-100749,00600010827,00100010761,Quote for Odonnell and Sons - Q1 2025,Rejected,2026-08-06,13527.9,566.75,13998.04,1036.89,13998.04,157.76,"Baby look realize focus star. Us think miss record different possible necessary religious. Author and rich where.
Only alone picture large. Two tonight billion everybody loss.",False,0050016,2026-07-07 17:21:13,2026-07-19 17:21:13,False
0Q000010750,QT-100750,00600010828,00100010762,Quote for Robertson-Robinson - Q1 2025,Presented to Customer,2021-11-27,28537.93,871.85,29879.37,2213.29,29879.37,458.98,"Change his various accept approach. Behind room one produce possible.
Doctor through treatment box then. Up catch through owner two.",False,0050003,2021-10-28 17:21:13,2021-11-27 17:21:13,False
0Q000010751,QT-100751,00600010828,00100010762,Quote for Robertson-Robinson - Q1 2025,Rejected,2021-10-22,32290.45,1683.2,33055.83,2448.58,33055.83,120.65,Go compare hit price American research recognize get. Thank society than material pull PM seat magazine. Beat activity range cost natural form research effect.,False,0050003,2021-09-22 17:21:13,2021-10-19 17:21:13,False
0Q000010752,QT-100752,00600010830,00100010763,Quote for Pollard-Holmes - Q4 2024,Approved,2022-05-15,4279.06,105.85,4507.07,333.86,4507.07,495.86,Look white family military mind. Small operation entire kitchen represent kind picture. Yeah rock spring me history indicate issue.,False,0050016,2022-04-15 17:21:13,2022-05-12 17:21:13,False
0Q000010753,QT-100753,00600010832,00100010764,"Quote for Douglas, Townsend and Hicks - Q1 2024",Approved,2023-02-13,105272.86,11427.02,101353.51,7507.67,101353.51,240.33,Yeah thing list test discuss. Table above present hour. Alone break sea reflect economic seven cover hospital.,False,0050010,2023-01-14 17:21:13,2023-01-15 17:21:13,False
0Q000010754,QT-100754,00600010832,00100010764,"Quote for Douglas, Townsend and Hicks - Q1 2024",Approved,2023-02-05,105057.57,1263.46,112097.64,8303.53,112097.64,217.34,"Here civil stock local. Million fire hotel apply money I. Prepare simply low.
Really Mr drop federal.
Character bit entire including real notice. Drop so state organization thank sure section.",False,0050010,2023-01-06 17:21:13,2023-01-14 17:21:13,False
0Q000010755,QT-100755,00600010833,00100010764,"Quote for Douglas, Townsend and Hicks - Q4 2025",Draft,2022-12-25,415982.03,14648.78,433439.91,32106.66,433439.91,151.11,"More treat compare computer. Business bad compare college forward structure finally.
Fine box exactly air thus last. Left term become eat film some side. Loss shoulder car we west main.",False,0050010,2022-11-25 17:21:13,2022-12-08 17:21:13,False
0Q000010756,QT-100756,00600010836,00100010766,Quote for Koch PLC - Q4 2025,Presented to Customer,2025-11-27,442831.72,15821.19,461171.37,34160.84,461171.37,221.13,"Leader near husband. About several man form reason charge entire. Threat according consumer ability off doctor.
One certain on president from arm system. Happen lay outside start court though.",False,0050017,2025-10-28 17:21:13,2025-11-23 17:21:13,False
0Q000010757,QT-100757,00600010836,00100010766,Quote for Koch PLC - Q4 2025,In Review,2025-12-17,478323.16,59595.57,452225.8,33498.21,452225.8,284.64,Create authority major research gun or. Street young language economic.,False,0050017,2025-11-17 17:21:13,2025-12-09 17:21:13,False
0Q000010758,QT-100758,00600010837,00100010766,Quote for Koch PLC - Q1 2024,Approved,2026-08-13,39213.53,1235.26,41016.53,3038.26,41016.53,106.19,"Common different relationship quite quality evening. Whom example join between executive successful three.
Reduce great strong allow particular traditional. Maybe agent bed after forget among.",False,0050017,2026-07-14 17:21:13,2026-08-04 17:21:13,False
0Q000010759,QT-100759,00600010838,00100010767,Quote for Bennett Ltd - Q4 2024,In Review,2025-04-05,45070.45,3037.88,45395.18,3362.61,45395.18,266.73,Red specific audience carry range. Detail three central after participant resource find. Allow heart show year energy yet couple know.,False,0050015,2025-03-06 17:21:13,2025-04-04 17:21:13,False
0Q000010760,QT-100760,00600010838,00100010767,Quote for Bennett Ltd - Q4 2024,Rejected,2025-03-27,40031.97,5377.66,37426.65,2772.34,37426.65,304.16,"Number nation cut line police.
Place live magazine operation. Ahead television home mother concern human.
Check human notice camera everybody onto. Visit those knowledge pull. Agency threat pay.",False,0050015,2025-02-25 17:21:13,2025-03-11 17:21:13,False
0Q000010761,QT-100761,00600010840,00100010767,Quote for Bennett Ltd - Q1 2025,Approved,2024-07-04,92076.37,430.19,98977.87,7331.69,98977.87,153.85,Environment method gun material follow knowledge. While book maybe white certainly. Role news upon condition however.,False,0050015,2024-06-04 17:21:13,2024-06-07 17:21:13,False
0Q000010762,QT-100762,00600010840,00100010767,Quote for Bennett Ltd - Q1 2025,Presented to Customer,2024-06-06,96690.95,7026.1,96838.04,7173.19,96838.04,100.77,Cup garden poor group single sing success. Even civil official home.,False,0050015,2024-05-07 17:21:13,2024-05-26 17:21:13,False
0Q000010763,QT-100763,00600010842,00100010773,Quote for Chan-Shannon - Q3 2025,Rejected,2023-07-05,63110.66,3361.3,64529.31,4779.95,64529.31,492.45,"Both road career.
Room up risk bit sense.
Difference television cut little. Tv collection ability size. Economic cover firm eat life.",False,0050001,2023-06-05 17:21:13,2023-06-14 17:21:13,False
0Q000010764,QT-100764,00600010842,00100010773,Quote for Chan-Shannon - Q3 2025,Presented to Customer,2023-06-27,57806.47,7459.42,54374.81,4027.76,54374.81,212.41,"Forget movie type team hold ahead.
Compare miss lot read. Thousand politics sea now exactly then miss shake.
Staff government rather late into field hit. Public media sport after.",False,0050001,2023-05-28 17:21:13,2023-06-17 17:21:13,False
0Q000010765,QT-100765,00600010843,00100010773,Quote for Chan-Shannon - Q4 2025,Approved,2023-11-17,74750.09,8270.5,71797.96,5318.37,71797.96,482.3,"Position laugh character head step now rather. Candidate ahead point gun newspaper. Reach two rock.
Case hand cell computer. Health past out event. Event rich expect century those film quickly.",False,0050001,2023-10-18 17:21:13,2023-11-08 17:21:13,False
0Q000010766,QT-100766,00600010843,00100010773,Quote for Chan-Shannon - Q4 2025,Rejected,2023-11-23,86085.46,11886.68,80134.68,5935.9,80134.68,213.15,Citizen board better hotel front. Air bring outside think. So participant home note model.,False,0050001,2023-10-24 17:21:13,2023-10-31 17:21:13,False
0Q000010767,QT-100767,00600010844,00100010775,Quote for Schneider-Miller - Q3 2025,In Review,2021-07-12,152262.52,17522.47,145519.25,10779.2,145519.25,261.24,"Number major knowledge meet movement impact season leader. Late laugh strategy most too join. Benefit compare staff chair.
Become production so. Fire power relate partner hot.",False,0050004,2021-06-12 17:21:13,2021-06-29 17:21:13,False
0Q000010768,QT-100768,00600010845,00100010775,Quote for Schneider-Miller - Q1 2024,In Review,2021-05-30,11449.71,913.88,11378.7,842.87,11378.7,74.41,Through resource activity memory government as compare around. Court couple lose structure sit around seven. Quickly theory build bit data.,False,0050004,2021-04-30 17:21:13,2021-05-19 17:21:13,False
0Q000010769,QT-100769,00600010845,00100010775,Quote for Schneider-Miller - Q1 2024,Rejected,2021-06-30,12159.41,1636.76,11364.46,841.81,11364.46,468.52,Wait method stay. Trouble relationship art world husband drug PM author. Fund reduce support ten.,False,0050004,2021-05-31 17:21:13,2021-06-25 17:21:13,False
0Q000010770,QT-100770,00600010846,00100010775,Quote for Schneider-Miller - Q4 2025,Accepted,2021-04-24,1308949.86,14331.48,1398187.85,103569.47,1398187.85,191.91,"Good near can create particular necessary ask health. Although education summer remember.
Real new item money simple sound nice. There bit alone mean purpose although.",False,0050004,2021-03-25 17:21:13,2021-04-16 17:21:13,False
0Q000010771,QT-100771,00600010846,00100010775,Quote for Schneider-Miller - Q4 2025,Accepted,2021-04-19,1172520.91,139623.03,1115529.71,82631.83,1115529.71,154.27,"Hour operation degree if year deep. Project floor bank whom message increase claim difference.
Among money style region special know off. Although side money short carry.",False,0050004,2021-03-20 17:21:13,2021-04-13 17:21:13,False
