Id,QuoteNumber,OpportunityId,AccountId,Name,Status,ExpirationDate,Subtotal,Discount,TotalPrice,Tax,GrandTotal,ShippingHandling,Description,IsSyncing,OwnerId,CreatedDate,LastModifiedDate,IsDeleted
0Q000010279,QT-100279,00600010308,00100010290,Quote for Velasquez Group - Q2 2025,Rejected,2022-08-20,306807.85,4820.81,326146.0,24158.96,326146.0,433.81,Nor report man but ever help development. Approach who wait watch. Determine almost artist smile.,False,0050018,2022-07-21 17:21:13,2022-08-13 17:21:13,False
0Q000010280,QT-100280,00600010309,00100010290,Quote for Velasquez Group - Q2 2025,Approved,2022-07-01,36745.87,2884.19,36570.61,2708.93,36570.61,234.29,"Toward north off image pass. Long gas ability read. Hair lawyer issue present not different song take.
Expect single into high particular away give. Result report line summer with.",False,0050018,2022-06-01 17:21:13,2022-06-06 17:21:13,False
0Q000010281,QT-100281,00600010309,00100010290,Quote for Velasquez Group - Q2 2025,In Review,2022-05-24,43025.49,2068.71,44233.32,3276.54,44233.32,290.13,"Present security section responsibility travel arrive. My month talk turn ago student.
Word support way when site clear face. Dream catch generation scene peace happen.",False,0050018,2022-04-24 17:21:13,2022-05-11 17:21:13,False
0Q000010282,QT-100282,00600010310,00100010293,Quote for Jones PLC - Q2 2024,Presented to Customer,2022-07-09,410526.27,17118.8,424880.07,31472.6,424880.07,361.07,"Rule material share.
Capital against meet human chair first challenge. Back mention draw particular.",False,0050003,2022-06-09 17:21:13,2022-06-17 17:21:13,False
0Q000010283,QT-100283,00600010311,00100010294,Quote for Moore Inc - Q4 2025,Presented to Customer,2023-05-01,170716.96,1269.89,183002.84,13555.77,183002.84,414.54,Economy option sign ability article region dark. Benefit security time buy perhaps. Certainly everyone ever grow.,False,0050013,2023-04-01 17:21:13,2023-04-28 17:21:13,False
0Q000010284,QT-100284,00600010311,00100010294,Quote for Moore Inc - Q4 2025,Approved,2023-04-24,151192.15,22190.66,139321.61,10320.12,139321.61,325.02,"Message guess far step Mr. Thought adult possible Mrs inside anything skill.
Hot available listen half major whole choose. Activity position could case.",False,0050013,2023-03-25 17:21:13,2023-03-26 17:21:13,False
0Q000010285,QT-100285,00600010312,00100010295,"Quote for Lewis, Carroll and Huerta - Q4 2024",In Review,2022-09-27,72656.63,6501.05,71448.03,5292.45,71448.03,193.16,"Ago suggest military fish leave. Pretty off evening spend kind cut end.
Billion none hard building blue example rich TV. Right think worry other very pretty consumer.",False,0050011,2022-08-28 17:21:13,2022-09-27 17:21:13,False
0Q000010286,QT-100286,00600010312,00100010295,"Quote for Lewis, Carroll and Huerta - Q4 2024",In Review,2022-09-22,66657.2,5340.12,66222.45,4905.37,66222.45,366.52,"Term how south. Especially hold need campaign direction suffer.
Since local college at accept. Class contain city difference very. Billion expect she form interesting group property evidence.",False,0050011,2022-08-23 17:21:13,2022-09-06 17:21:13,False
0Q000010287,QT-100287,00600010313,00100010296,"Quote for Bowers, Sheppard and Kim - Q3 2024",Approved,2024-11-17,521197.09,74216.06,482739.51,35758.48,482739.51,385.36,"Bad million inside. Specific product clearly picture happy left standard.
Contain decade identify player.
Sea phone better loss song seem red.",False,0050015,2024-10-18 17:21:13,2024-11-07 17:21:13,False
0Q000010288,QT-100288,00600010314,00100010301,Quote for Nichols and Sons - Q3 2025,Presented to Customer,2023-01-12,176437.54,1537.2,188892.37,13992.03,188892.37,307.81,"Person address when ready. Person your city.
Feel serve strong. One lot if arm care. Spring necessary hope who follow.
Mother model person college. Tend system and two nice letter some.",False,0050009,2022-12-13 17:21:13,2023-01-02 17:21:13,False
0Q000010289,QT-100289,00600010314,00100010301,Quote for Nichols and Sons - Q3 2025,In Review,2023-01-22,177048.11,21770.77,167699.53,12422.19,167699.53,85.2,"Picture industry tax open. Process what impact.
System agent yes send safe. Employee start from. In those key last.",False,0050009,2022-12-23 17:21:13,2023-01-10 17:21:13,False
0Q000010290,QT-100290,00600010315,00100010302,Quote for Preston-Schultz - Q2 2025,Accepted,2023-03-08,292915.17,15708.14,299383.59,22176.56,299383.59,182.62,"Source improve many economic thought. Guy three piece good.
Wrong picture reason. Nature left hard.",False,0050014,2023-02-06 17:21:13,2023-02-19 17:21:13,False
0Q000010291,QT-100291,00600010315,00100010302,Quote for Preston-Schultz - Q2 2025,Accepted,2023-02-05,241570.94,26344.07,232445.02,17218.15,232445.02,413.45,"Best process quickly sport anything left public. Mr much important beat. Four seven stock tonight form something late per.
Enter those party sport admit. Simply as citizen office well ago.",False,0050014,2023-01-06 17:21:13,2023-02-05 17:21:13,False
0Q000010292,QT-100292,00600010316,00100010302,Quote for Preston-Schultz - Q3 2025,Accepted,2023-03-28,641181.81,7066.06,684845.01,50729.26,684845.01,284.43,"Agreement chance fund feeling.
First each wide Republican. Office the against he everybody want. Probably quality four. Again world picture.",False,0050014,2023-02-26 17:21:13,2023-03-25 17:21:13,False
0Q000010293,QT-100293,00600010317,00100010304,Quote for Hurst-Weiss - Q4 2024,Accepted,2023-07-20,66245.76,1324.19,70115.3,5193.73,70115.3,485.66,"Five majority take example. But her she fund doctor will. Opportunity financial only both challenge. Five meet outside lose.
Strategy finally few daughter employee early go.",False,0050010,2023-06-20 17:21:13,2023-07-20 17:21:13,False
0Q000010294,QT-100294,00600010317,00100010304,Quote for Hurst-Weiss - Q4 2024,Accepted,2023-06-18,58216.53,2983.39,59651.79,4418.65,59651.79,337.56,"Seek ask huge activity. Crime television statement. Bed somebody future law because body.
Technology me reason enough. Commercial any middle skin. Worry blood best age admit.",False,0050010,2023-05-19 17:21:13,2023-06-09 17:21:13,False
0Q000010295,QT-100295,00600010318,00100010304,Quote for Hurst-Weiss - Q3 2024,Approved,2023-06-12,6892.83,513.03,6890.18,510.38,6890.18,30.53,"Society somebody form. Value upon citizen character body agree.
Road save feeling half. Word door rest point key.
Result house poor that.",False,0050010,2023-05-13 17:21:13,2023-05-26 17:21:13,False
0Q000010296,QT-100296,00600010319,00100010307,Quote for Johnson Inc - Q4 2025,In Review,2022-04-13,7682.18,1081.07,7129.2,528.09,7129.2,377.41,"Form hotel argue a win final without. Any table indicate put admit just artist.
Take run quickly employee. Each later city down hour run.",False,0050004,2022-03-14 17:21:13,2022-03-19 17:21:13,False
0Q000010297,QT-100297,00600010319,00100010307,Quote for Johnson Inc - Q4 2025,Draft,2022-03-10,7470.65,304.97,7738.93,573.25,7738.93,99.48,Enter career nor good chair town best. Best tough cell clearly will final. Training need shoulder debate newspaper five.,False,0050004,2022-02-08 17:21:13,2022-02-11 17:21:13,False
0Q000010298,QT-100298,00600010323,00100010310,Quote for Gomez and Sons - Q2 2025,In Review,2023-10-08,46018.85,1179.7,48426.28,3587.13,48426.28,338.63,Friend never issue sea relationship view difficult. Even pass rest point until success. Economic professor down resource artist social because.,False,0050017,2023-09-08 17:21:13,2023-09-30 17:21:13,False
0Q000010299,QT-100299,00600010323,00100010310,Quote for Gomez and Sons - Q2 2025,Approved,2023-10-01,46663.41,557.81,49794.05,3688.45,49794.05,468.63,"Rate hour often feel.
Beat respond find hard example. Important only visit the base purpose drive home. Mr identify behind about.",False,0050017,2023-09-01 17:21:13,2023-09-09 17:21:13,False
0Q000010300,QT-100300,00600010325,00100010311,Quote for Jacobson PLC - Q2 2025,Approved,2022-06-10,139632.83,875.0,149858.46,11100.63,149858.46,153.64,"Executive trial air might me. Suddenly its draw as between. Begin coach say far.
Eat free risk short cell. Page despite final perform activity hope which.",False,0050015,2022-05-11 17:21:13,2022-06-10 17:21:13,False
0Q000010301,QT-100301,00600010325,00100010311,Quote for Jacobson PLC - Q2 2025,Approved,2022-05-01,147740.0,9114.66,149715.37,11090.03,149715.37,181.04,Attack bed economy police common woman. Subject wrong word science allow but process. Treat common safe could others.,False,0050015,2022-04-01 17:21:13,2022-04-16 17:21:13,False
0Q000010302,QT-100302,00600010326,00100010312,Quote for Wade Group - Q3 2024,Approved,2023-11-27,14923.16,1565.24,14426.55,1068.63,14426.55,291.62,"Recent life somebody rather. Involve personal staff care hard and. Yet economy change.
Together the agree success. Professor news anything work.",False,0050016,2023-10-28 17:21:13,2023-11-11 17:21:13,False
0Q000010303,QT-100303,00600010326,00100010312,Quote for Wade Group - Q3 2024,In Review,2023-11-14,17238.25,51.44,18561.75,1374.94,18561.75,362.71,"Sort market white fear thank send. Boy tree once already push. Social at head space by.
Quickly sense store policy attorney. Once like reflect usually. Goal likely around foot chair structure.",False,0050016,2023-10-15 17:21:13,2023-10-19 17:21:13,False
0Q000010304,QT-100304,00600010328,00100010313,Quote for Ellis-Carey - Q1 2025,Presented to Customer,2022-05-28,153237.9,245.89,165231.37,12239.36,165231.37,419.03,Find wife wide commercial. Make travel officer defense room watch. Record ball suggest think general everybody.,False,0050003,2022-04-28 17:21:13,2022-05-12 17:21:13,False
0Q000010305,QT-100305,00600010329,00100010314,Quote for Lee-Riley - Q3 2024,Accepted,2022-07-16,33168.15,2676.38,32931.11,2439.34,32931.11,109.23,"Wait late difference hope power realize detail. Out style do matter money open.
Term discuss great offer future behavior sort. Industry year market understand.",False,0050013,2022-06-16 17:21:13,2022-06-27 17:21:13,False
0Q000010306,QT-100306,00600010329,00100010314,Quote for Lee-Riley - Q3 2024,Accepted,2022-07-10,32390.72,4120.0,30532.38,2261.66,30532.38,246.51,"Above business event. College kind wind become well government goal her.
Enter computer office although knowledge current. Front foreign effect and technology tough far.",False,0050013,2022-06-10 17:21:13,2022-06-15 17:21:13,False
0Q000010307,QT-100307,00600010330,00100010314,Quote for Lee-Riley - Q4 2025,Presented to Customer,2022-12-28,185352.89,27299.32,170697.86,12644.29,170697.86,93.5,"May find letter section. Carry expert officer idea nice couple strategy.
Wide start job without. Artist exactly hard career. Reason same own knowledge others.",False,0050013,2022-11-28 17:21:13,2022-12-28 17:21:13,False
0Q000010308,QT-100308,00600010331,00100010315,Quote for Bell LLC - Q1 2025,In Review,2025-02-10,12990.04,211.1,13801.26,1022.32,13801.26,136.52,"Air enter of know evidence such show. Debate fine run need article. Vote leader arm Democrat behavior economy red.
Pretty someone down most place. Tell anything hard take seem.",False,0050005,2025-01-11 17:21:13,2025-02-01 17:21:13,False
0Q000010309,QT-100309,00600010333,00100010316,Quote for Miller-Knight - Q3 2024,Presented to Customer,2023-01-09,186687.63,4411.59,196858.12,14582.08,196858.12,144.91,"Write pay its run city over. Feeling Republican bad new suggest.
Fill high medical by. Lot collection great hospital others suffer process.
Figure late fish. Wish your let.",False,0050004,2022-12-10 17:21:13,2023-01-07 17:21:13,False
0Q000010310,QT-100310,00600010334,00100010316,Quote for Miller-Knight - Q1 2024,Presented to Customer,2022-12-17,67746.43,1299.95,71762.2,5315.72,71762.2,436.87,"Become yeah future often. Mean go project everybody surface dark include. Lot bed it tree term player test address.
Job agree cut always. Foot spring trip end economic into son. Cost well cold.",False,0050004,2022-11-17 17:21:13,2022-11-27 17:21:13,False
0Q000010311,QT-100311,00600010336,00100010318,Quote for Hanson-Gonzalez - Q2 2024,Rejected,2025-10-01,18896.37,2587.36,17613.73,1304.72,17613.73,219.67,"Fish kind speak structure. One between stage nice begin information.
Voice many son message plant age finally. With ahead husband cause responsibility herself.",False,0050012,2025-09-01 17:21:13,2025-09-27 17:21:13,False
0Q000010312,QT-100312,00600010336,00100010318,Quote for Hanson-Gonzalez - Q2 2024,Rejected,2025-10-05,19103.73,1380.88,19140.68,1417.83,19140.68,430.14,"Beautiful card whom professor subject arm. Much forget bring message enjoy clear.
Meet thought enjoy wish. Window theory loss family. Right century maybe pretty piece.
Reality card property real.",False,0050012,2025-09-05 17:21:13,2025-09-21 17:21:13,False
0Q000010313,QT-100313,00600010337,00100010319,Quote for Hunt Ltd - Q3 2025,In Review,2023-03-09,2074537.34,286887.34,1930662.0,143012.0,1930662.0,6.27,"Minute family bed. Game sure guy meeting although hit director. Leg baby wind government.
Some person least reality. Move wait decide minute color.",False,0050010,2023-02-07 17:21:13,2023-02-11 17:21:13,False
0Q000010314,QT-100314,00600010342,00100010324,Quote for Gonzalez-Barron - Q2 2025,Approved,2021-12-19,37838.67,3956.65,36592.58,2710.56,36592.58,63.17,"Best agreement truth agreement financial trial.
Another themselves get next agent though. Opportunity PM first task.
Film whatever bring evening skill. Raise act have pressure election authority get.",False,0050017,2021-11-19 17:21:13,2021-11-25 17:21:13,False
0Q000010315,QT-100315,00600010343,00100010324,Quote for Gonzalez-Barron - Q3 2024,Accepted,2022-03-13,26981.02,2938.74,25965.66,1923.38,25965.66,181.69,Can most chance agreement increase world when collection. Tend lay us teacher eye. Edge issue out than receive ball around interest. Well threat forget brother wonder.,False,0050017,2022-02-11 17:21:13,2022-02-19 17:21:13,False
0Q000010316,QT-100316,00600010345,00100010326,Quote for Perez Ltd - Q3 2024,Presented to Customer,2021-08-17,733913.33,87712.19,697897.23,51696.09,697897.23,140.28,"Senior hard space choice Republican baby. Others director party.
Sign either fill determine data. Card similar everyone bed family save growth.",False,0050017,2021-07-18 17:21:13,2021-08-09 17:21:13,False
0Q000010317,QT-100317,00600010346,00100010326,Quote for Perez Ltd - Q2 2024,In Review,2021-09-18,33509.04,3557.83,32347.31,2396.1,32347.31,203.43,"Economic turn billion focus. Would reduce mouth decision marriage matter break with.
With window early understand. Base bank despite rest sister. Hot like level card seat consumer it.",False,0050017,2021-08-19 17:21:13,2021-09-04 17:21:13,False
0Q000010318,QT-100318,00600010347,00100010326,Quote for Perez Ltd - Q1 2024,Approved,2021-06-18,187997.2,11695.01,190406.37,14104.18,190406.37,66.98,"Popular just tree word indicate hard. Need get Congress some offer.
Policy according thing least activity indeed. Skill long turn class church chair.",False,0050017,2021-05-19 17:21:13,2021-06-08 17:21:13,False
0Q000010319,QT-100319,00600010347,00100010326,Quote for Perez Ltd - Q1 2024,Presented to Customer,2021-05-27,186137.42,15683.26,184090.49,13636.33,184090.49,182.21,"Develop skill several hit. Himself morning nothing evening deal. Entire out interest central expect.
Natural executive item true room late.",False,0050017,2021-04-27 17:21:13,2021-05-25 17:21:13,False
0Q000010320,QT-100320,00600010348,00100010329,Quote for Martin-James - Q2 2025,Approved,2024-01-03,574429.06,15721.77,603403.87,44696.58,603403.87,59.83,Interest realize finish enter. Record see red family though. Size already nice different despite street think.,False,0050003,2023-12-04 17:21:13,2023-12-08 17:21:13,False
0Q000010321,QT-100321,00600010351,00100010331,Quote for Gregory LLC - Q4 2025,Accepted,2025-11-11,83718.31,4459.45,85599.57,6340.71,85599.57,478.15,Unit yeah through opportunity management most. Cold fish election model. Network how animal course body good staff address.,False,0050009,2025-10-12 17:21:13,2025-10-14 17:21:13,False
0Q000010322,QT-100322,00600010351,00100010331,Quote for Gregory LLC - Q4 2025,Accepted,2025-12-12,74641.63,6543.08,73546.43,5447.88,73546.43,333.36,Decide sing general challenge produce stage. Dark challenge eye statement price into apply. Parent fall participant nearly.,False,0050009,2025-11-12 17:21:13,2025-11-28 17:21:13,False
0Q000010323,QT-100323,00600010353,00100010332,Quote for Rodriguez and Sons - Q1 2024,In Review,2023-01-17,62473.55,5118.47,61943.49,4588.41,61943.49,107.33,"Positive full report my.
Her offer member. Seat central a big she above. Sit including edge identify.
Public discussion item big billion especially that job. Check message game. About need before.",False,0050003,2022-12-18 17:21:13,2022-12-25 17:21:13,False
0Q000010324,QT-100324,00600010353,00100010332,Quote for Rodriguez and Sons - Q1 2024,Approved,2023-01-27,68772.93,9070.23,64478.92,4776.22,64478.92,168.11,Six light usually. Answer standard organization you agreement six southern interview. Difference medical agency heart garden.,False,0050003,2022-12-28 17:21:13,2023-01-03 17:21:13,False
0Q000010325,QT-100325,00600010354,00100010332,Quote for Rodriguez and Sons - Q3 2025,Rejected,2022-12-16,538923.25,35398.95,543806.24,40281.94,543806.24,296.81,Power experience research high. Inside character short daughter. Natural area our dinner concern bar general.,False,0050003,2022-11-16 17:21:13,2022-12-02 17:21:13,False
0Q000010326,QT-100326,00600010355,00100010332,Quote for Rodriguez and Sons - Q2 2025,Rejected,2023-01-12,12771.07,1267.92,12423.4,920.25,12423.4,362.1,Just onto speech you training again southern. Station pattern offer past whom Mrs probably.,False,0050003,2022-12-13 17:21:13,2022-12-15 17:21:13,False
0Q000010327,QT-100327,00600010355,00100010332,Quote for Rodriguez and Sons - Q2 2025,Rejected,2023-01-04,11318.34,989.61,11155.03,826.3,11155.03,444.81,"Item happy community current. Attention whom lead represent green worker. Possible just fish common majority.
Good for and Mr want more. Short home drive then teacher.
Loss will authority.",False,0050003,2022-12-05 17:21:13,2022-12-19 17:21:13,False
0Q000010328,QT-100328,00600010356,00100010333,Quote for Edwards-Compton - Q3 2024,Approved,2022-04-07,31960.36,1217.96,33201.79,2459.39,33201.79,287.26,Later art that forward page television crime whom. Technology society eye coach experience child enough require.,False,0050005,2022-03-08 17:21:13,2022-04-02 17:21:13,False
0Q000010329,QT-100329,00600010357,00100010333,Quote for Edwards-Compton - Q3 2025,Presented to Customer,2022-07-19,31984.86,4629.84,29543.42,2188.4,29543.42,5.81,Player growth Democrat you now. Cause front bar above.,False,0050005,2022-06-19 17:21:13,2022-07-14 17:21:13,False
0Q000010330,QT-100330,00600010358,00100010333,Quote for Edwards-Compton - Q1 2025,Draft,2022-05-14,171799.5,20583.63,163313.14,12097.27,163313.14,112.52,"Standard bring during east force team alone.
Say that room or above. Authority not cup recently know produce. Past room many move medical fish if.
Involve level environmental remain create evening.",False,0050005,2022-04-14 17:21:13,2022-04-20 17:21:13,False
0Q000010331,QT-100331,00600010359,00100010334,"Quote for Lucero, Johnston and Chen - Q1 2025",In Review,2022-03-24,273128.14,9707.29,284494.52,21073.67,284494.52,34.05,"Often more world range.
Than avoid full only present fill court two. Produce deal agreement close perhaps religious support.
Rest ever practice area year fill after.",False,0050008,2022-02-22 17:21:13,2022-02-27 17:21:13,False
0Q000010332,QT-100332,00600010360,00100010335,"Quote for Jensen, Mcknight and Williams - Q2 2024",Presented to Customer,2024-11-29,7346.68,1013.72,6839.6,506.64,6839.6,175.14,"Population identify this develop. Join water data alone safe yourself.
Gas sound executive collection close federal. Everyone four ability guy beat happen ok.",False,0050002,2024-10-30 17:21:13,2024-11-10 17:21:13,False
0Q000010333,QT-100333,00600010360,00100010335,"Quote for Jensen, Mcknight and Williams - Q2 2024",In Review,2024-11-24,6990.66,129.68,7409.86,548.88,7409.86,411.18,Major difference style national peace source lot. Difficult paper real executive society indicate beyond total. Certainly experience marriage employee figure technology experience.,False,0050002,2024-10-25 17:21:13,2024-11-18 17:21:13,False
0Q000010334,QT-100334,00600010361,00100010336,Quote for Morris-Flores - Q4 2025,In Review,2022-07-01,37627.99,1583.97,38927.54,2883.52,38927.54,65.57,"Southern analysis particular word form finish trial. Serious way story serious. Candidate form clear.
Add human medical participant artist avoid contain. Beat lot our election though wonder hard.",False,0050006,2022-06-01 17:21:13,2022-06-21 17:21:13,False
0Q000010335,QT-100335,00600010361,00100010336,Quote for Morris-Flores - Q4 2025,In Review,2022-07-10,38033.1,3712.06,37066.72,2745.68,37066.72,93.43,"Hit movement represent. Five language fly determine bit party lead.
Room knowledge who may hard whatever. Social which there even event. Go large edge subject.",False,0050006,2022-06-10 17:21:13,2022-06-13 17:21:13,False
0Q000010336,QT-100336,00600010362,00100010336,Quote for Morris-Flores - Q4 2024,Approved,2022-06-03,6868.3,665.82,6698.68,496.2,6698.68,166.64,Alone stage form he myself. Ability office morning stuff. Deep since baby person race suggest.,False,0050006,2022-05-04 17:21:13,2022-05-11 17:21:13,False
0Q000010337,QT-100337,00600010362,00100010336,Quote for Morris-Flores - Q4 2024,In Review,2022-05-30,7560.88,1019.81,7064.36,523.29,7064.36,237.62,"Black lose young writer carry degree manage. Seat may citizen would most.
Value agent claim this both season. Hope population agree apply adult hit.",False,0050006,2022-04-30 17:21:13,2022-05-16 17:21:13,False
0Q000010338,QT-100338,00600010363,00100010336,Quote for Morris-Flores - Q2 2025,Rejected,2021-11-05,37599.23,2978.75,37390.12,2769.64,37390.12,156.36,Free word past or brother. Remain point Republican fly other order. Picture question institution bar economic. Bag majority hit note cell reflect institution guess.,False,0050006,2021-10-06 17:21:13,2021-10-13 17:21:13,False
0Q000010339,QT-100339,00600010364,00100010337,"Quote for Medina, Lee and Freeman - Q4 2025",Approved,2023-12-16,284201.92,35315.15,268797.71,19910.94,268797.71,324.82,"Practice really ok your. Structure almost pick hope. Great second talk open weight support.
Past structure account professor. For involve couple.",False,0050016,2023-11-16 17:21:13,2023-11-18 17:21:13,False
0Q000010340,QT-100340,00600010364,00100010337,"Quote for Medina, Lee and Freeman - Q4 2025",Rejected,2023-11-29,284410.75,26932.25,278076.78,20598.28,278076.78,234.16,"Event stage rich. Site executive huge action especially create.
Laugh likely shoulder management lead. Structure all guess manage. Anyone people around leave rate pick prevent.",False,0050016,2023-10-30 17:21:13,2023-11-09 17:21:13,False
0Q000010341,QT-100341,00600010366,00100010340,Quote for Barnes-West - Q4 2024,Presented to Customer,2023-11-17,20862.8,2100.72,20263.05,1500.97,20263.05,48.03,"Mention left recognize simple cup writer door fight.
Despite agree prevent type. Participant chair quickly.",False,0050009,2023-10-18 17:21:13,2023-10-24 17:21:13,False
0Q000010342,QT-100342,00600010367,00100010343,Quote for Lee-Obrien - Q4 2025,In Review,2023-09-28,2351712.66,196594.01,2327528.14,172409.49,2327528.14,3.99,Live choice east finally sign task our. Region base enough around relationship dog commercial. Season these difficult more magazine law attention at.,False,0050002,2023-08-29 17:21:13,2023-09-26 17:21:13,False
0Q000010343,QT-100343,00600010371,00100010347,Quote for Davis-Weber - Q1 2025,Approved,2024-02-22,12509.7,378.96,13101.2,970.46,13101.2,350.57,"South society send expect look. Special back manage consumer difficult any small.
Central raise agency face coach focus weight. Option available blue court decision thank matter.",False,0050004,2024-01-23 17:21:13,2024-02-01 17:21:13,False
0Q000010344,QT-100344,00600010371,00100010347,Quote for Davis-Weber - Q1 2025,Approved,2024-03-02,12249.46,593.94,12587.96,932.44,12587.96,322.27,"City huge TV loss. West decide bank set pull choice song. Coach rock production occur entire reach really stock.
Age image raise off lawyer.",False,0050004,2024-02-01 17:21:13,2024-02-11 17:21:13,False
0Q000010345,QT-100345,00600010372,00100010349,"Quote for Thomas, Kim and Alexander - Q1 2024",Accepted,2024-05-07,74141.75,1981.56,77933.01,5772.82,77933.01,124.82,"Friend factor fund body. Since source ago.
Create agent financial perform. Attention career writer camera. Life improve wonder maintain.",False,0050019,2024-04-07 17:21:13,2024-04-27 17:21:13,False
0Q000010346,QT-100346,00600010372,00100010349,"Quote for Thomas, Kim and Alexander - Q1 2024",Accepted,2024-04-02,72435.15,2947.72,75046.42,5558.99,75046.42,97.73,"High end country science nature Mrs method. Available politics successful another although.
Tonight trial goal fly. Head ten probably early difference Mrs.",False,0050019,2024-03-03 17:21:13,2024-03-28 17:21:13,False
0Q000010347,QT-100347,00600010373,00100010350,Quote for Holland Ltd - Q3 2024,Accepted,2022-04-26,26658.32,2258.57,26351.73,1951.98,26351.73,97.31,Present my site. Heart hundred what carry nearly continue. Approach party born prepare their often. Fight there north generation.,False,0050006,2022-03-27 17:21:13,2022-04-12 17:21:13,False
0Q000010348,QT-100348,00600010375,00100010353,Quote for Krause LLC - Q4 2025,Rejected,2023-08-15,14232.9,2027.2,13182.16,976.46,13182.16,128.34,Thus part ago thank rather win. Again do near ask fire ten identify.,False,0050009,2023-07-16 17:21:13,2023-07-17 17:21:13,False
